{
  "id": "tm-budgeted-spin-discovery",
  "title": "Budgeted Active Discovery of Near-Degenerate Spin-State Candidates",
  "domain": "computational_chemistry",
  "task_sources": [
    {
      "name": "Task proposal",
      "url": "https://github.com/PrismaX-Team/LiveDiscoveryBench-Tasks/discussions/14"
    },
    {
      "name": "many_body_ml reference data and structures (pinned commit)",
      "url": "https://github.com/hjkgrp/many_body_ml/tree/27467b5d3d85fa42263d746d514461fa009b3c91/data"
    }
  ],
  "metric": {
    "description": "Arithmetic mean of unique confirmed discoveries over a fixed instance set at the fixed query budget; higher is better.",
    "type": "linear_maximize"
  },
  "baseline": {
    "existing_baseline": true,
    "name": "Adaptive interval-probability discovery strategy",
    "source": "https://github.com/solin-del/LiveDiscoveryBench-Tasks/tree/0cf270b18288728affb1ec9c682963d2b2a61562/baselines/tm-budgeted-spin-discovery",
    "score": 32.4,
    "bottom_line_score": 13.2
  }
}
