{
  "id": "replace-with-task-id",
  "title": "Replace with the task title",
  "domain": "replace-with-domain",
  "task_sources": [
    {
      "name": "Replace with the underlying dataset or repository",
      "url": "https://example.org/replace-with-stable-source"
    }
  ],
  "metric": {
    "description": "Replace with the raw metric definition and whether higher or lower is better.",
    "type": null
  }
}
